{
  "name": "threejs-game-skills",
  "description": "Three.js 浏览器游戏开发技能集：game-director 总路由，玩法 / 画质 / UI / 资产生成 / 调试 / QA 发布九技能。上游 MIT（Majid Manzarpour）。",
  "source": {
    "source": "github",
    "repo": "r-y-ren/threejs-game-skills"
  },
  "author": "r-y-ren",
  "homepage": "https://github.com/r-y-ren/threejs-game-skills",
  "tags": [
    "threejs",
    "game",
    "webgl",
    "skills"
  ]
}
