{
  "name": "zcode-fox-widget",
  "description": "ZCode狐娘小挂件（zcode-fox-widget）：多厂商计价（DeepSeek 峰谷 + GLM 平价分档；34 个厂商模板，含 Kimi/MiniMax/OpenCode Go 订阅窗口与 26 家无余额接口厂商）、GLM Plan 套餐配额（零密钥日志尾随）、CommandCode 三重额度（月度池 + 5 小时/周窗口）、每轮消耗（金额或配额百分比）、记账二级页（用量记录 / 额度预警 / 余额预警 / 余额校正）、按压泡泡（点击队列 + 模板导入导出）、五套内置角色（专属台词池与浅色配色跟随）、角色导入与改名/删除、三套主题（浅色 / 深色 / 跟随 ZCode）、桌宠模式（全屏工作区漫游 + 失焦不隐身）、计费源智能切换。移植自 MeteorNOX 的 DSH 版。",
  "source": {
    "source": "github",
    "repo": "pigeon189/zcode-fox-widget",
    "ref": "v1.9.0"
  },
  "author": "zcode-fox-widget contributors",
  "homepage": "https://github.com/pigeon189/zcode-fox-widget",
  "tags": [
    "deepseek",
    "balance",
    "widget",
    "whale",
    "usage"
  ]
}
