{
  "name": "ai-look-up",
  "description": "Detects aimless AI grinding (repeated commands, failure loops, long runs with no output) and injects mid-run self-review nudges plus real local-time anchors via hooks, so the AI looks up, re-checks progress and calibrates its time estimates.",
  "source": {
    "source": "github",
    "repo": "1344738825/ai-look-up"
  },
  "author": "shenjingbing",
  "homepage": "https://github.com/1344738825/ai-look-up"
}
