{
  "name": "strictlybetter",
  "description": "Universal noise-aware research loop for agentic coders: discover metrics, measure sigma, pre-register, confirm on holdout. Every merge is strictly better.",
  "source": {
    "source": "github",
    "repo": "nagisanzenin/strictlybetter",
    "ref": "v1.3.1"
  },
  "author": "nagisanzenin",
  "homepage": "https://github.com/nagisanzenin/strictlybetter",
  "tags": [
    "research-loop",
    "autoresearch",
    "optimization",
    "benchmarking",
    "noise-floor"
  ]
}
